开始时间,结束时间,字幕内容,字幕颜色
0:00:02.05,0:00:04.77,Translaroe: Melts/Timing: zhufree,
0:00:04.77,0:00:06.35,[Nangong Rang’s memory],
0:00:06.35,0:00:07.50,[Imperial palace of the former dynasty],
0:00:07.50,0:00:10.60,Shang Emperor: Traitors, you traitors,,
0:00:10.92,0:00:12.52,how dare you force me to abdicate,,
0:00:12.52,0:00:14.57,I, will kill you both!,
0:00:15.72,0:00:16.97,Nangong Rang(Middle-aged): Calm down, Your Majesty.,
0:00:16.97,0:00:21.17,Please stay away from the crafty consort, you must prioritize the kingdom!,
0:00:21.17,0:00:24.32,Highest Consort Wan: No, I'm not... Your Majesty…,
0:00:24.32,0:00:25.67,Lu Quan(Middle-aged): Please reconsider, Your Majesty.,
0:00:25.67,0:00:27.45,If you continue to persist in this erroneous path,,
0:00:27.45,0:00:30.10,this subject… is left with no choice but to slay the crafty consort,,
0:00:30.10,0:00:31.40,to purge the Emperor of vile influences!,
0:00:31.60,0:00:34.27,[Lu Quan pushes over the Shang Emperor],
0:00:34.47,0:00:38.25,Lu Quan: Crafty consort, you bewitched His Majesty, disrupting the court system,,
0:00:38.25,0:00:39.55,this is the end for you!,
0:00:40.15,0:00:41.75,Shang Emperor: Lu Quan, don’t you dare!,
0:00:45.50,0:00:49.75,Lu Quan: Sir Nangong, I will delay His Majesty, execute the crafty consort now!,
0:00:49.75,0:00:57.00,Highest Consort Wan: Minister Nangong… Chancellor, Sir Chancellor.,
0:00:57.40,0:00:59.05,Shang Emperor: Nangong Rang, don’t you dare!,
0:00:59.65,0:01:00.70,Highest Consort Wan: Sir Nangong,,
0:01:00.70,0:01:03.92,I am already carrying His Majesty’s only child, please…,
0:01:03.92,0:01:05.95,Lu Quan: Worthy brother, do it now!,
0:01:05.95,0:01:07.30,Nangong Rang: Forgive me.,
0:01:07.80,0:01:09.10,Highest Consort Wan: Your Majesty!,
0:01:20.95,0:01:23.37,Shang Emperor: My beloved!,
0:01:23.37,0:01:24.17,Nangong Rang: Your Majesty…,
0:01:34.80,0:01:37.65,Shang Emperor: Lu Quan, Nangong Rang…,
0:01:39.05,0:01:43.72,I, will have you torn to pieces!,
0:01:44.40,0:01:45.95,Lu Quan: Er-di, let’s go!,
0:01:47.90,0:01:51.50,Nangong Rang: Da-ge, the Emperor is enraged, our death is certain.,
0:01:51.50,0:01:54.50,Escape with your soldiers, I’m staying to pay for the witch consort’s life!,
0:01:55.65,0:01:56.67,Lu Quan: Ding Yi!,
0:01:56.67,0:01:57.57,Ding Yi: Brother-in-law!,
0:01:58.27,0:02:00.77,Lu Quan: Get a few trustworthy men to seal the palace gates!,
0:02:01.02,0:02:01.72,Ding Yi: Understood!,
0:02:17.30,0:02:20.35,Shang Emperor: Nangong Rang, Lu Quan,,
0:02:20.75,0:02:25.45,for your crimes of regicide and conspiracy against me, I will curse you!,
0:02:25.85,0:02:32.40,Someday, you will experience my pain ten times, a hundred times over!,
0:02:52.10,0:02:58.52,Sijiu: Your Majesty, Your Majesty, please don’t scare this old servant.,
0:03:00.20,0:03:03.00,Nangong Rang: Hurry, send people out to extinguish the fire,,
0:03:03.30,0:03:05.70,mobilize the imperial guard from downhill,,
0:03:06.42,0:03:10.45,and send another group of guards to protect the Zhenzhen Princess!,
0:03:11.20,0:03:12.00,Sijiu: Understood.,
0:03:19.65,0:03:23.87,Adapted from Jinjiang Literature City’s ‘Clear and Muddy Loss of Love’,,
0:03:24.47,0:03:26.07,an original work by Please Don’t Laugh,,
0:03:26.72,0:03:28.20,produced by Yinhang Media,,
0:03:28.80,0:03:31.35,broadcasting exclusively on Maoer FM,,
0:03:32.05,0:03:37.97,‘Two Adamant Hearts’ audio drama season one, episode nine,,
0:03:38.77,0:03:40.77,please enjoy.,
0:03:48.62,0:03:52.05,[Nangong Rang’s bedchamber],
0:03:54.40,0:03:55.52,Nangong Rang: Useless things,,
0:03:56.30,0:03:59.00,a fire on the ancestral mountain?,
0:04:00.42,0:04:02.02,What do you lot from the Ministry of the Royal Clan,,
0:04:02.02,0:04:03.30,the Ministry of Rites, and the imperial army do for a living?,
0:04:03.77,0:04:05.42,Guards: Please forgive us, Your Majesty.,
0:04:06.90,0:04:07.95,Nangong Rang: (violent coughing),
0:04:07.95,0:04:09.95,Nangong Wang: Please quell your anger, Emperor Father, your health is of the utmost importance…,
0:04:11.47,0:04:12.67,Nangong Jingnu: Emperor Father!,#FF7D40
0:04:13.30,0:04:14.60,Nangong Rang: My child is here?,
0:04:15.40,0:04:18.12,Come, quick, let me see you.,
0:04:18.92,0:04:20.70,[Nangong Jingnu goes to Nangong Rang’s side],
0:04:20.92,0:04:23.12,Nangong Jingnu: Emperor Father, don’t be angry anymore,,#FF7D40
0:04:23.35,0:04:24.57,anger harms the body.,#FF7D40
0:04:26.62,0:04:29.55,Nangong Rang: Why did you come here dressed so lightly?,
0:04:29.82,0:04:33.25,Although it is spring, it is still cold at night.,
0:04:34.92,0:04:35.90,Nangong Jingnu: Emperor Father…,#FF7D40
0:04:36.17,0:04:38.07,Nangong Rang: (coughing),
0:04:38.07,0:04:39.28,Sijiu: Your Majesty.,
0:04:39.28,0:04:42.17,This old servant has seen a great decrease in the scale of the fire.,
0:04:42.17,0:04:44.68,You must take care of your health, Your Majesty.,
0:04:45.22,0:04:45.87,Nangong Wang: Emperor Father,,
0:04:46.53,0:04:48.77,this son will lead another group of men and horses up the mountain to extinguish the fire.,
0:04:49.52,0:04:52.01,Sijiu gonggong, I will leave Emperor Father in your care.,
0:04:52.59,0:04:54.01,Sijiu: Rest assured, Your Highness.,
0:04:54.96,0:04:56.45,[Nangong Wang leaves],
0:04:56.72,0:04:57.52,Nangong Jingnu: Emperor Father,,#FF7D40
0:04:57.52,0:04:59.96,this daughter will help you sit down and rest?,#FF7D40
0:05:00.69,0:05:02.90,Nangong Rang: Alright, alright.,
0:05:04.41,0:05:05.01,Nangong Jingnu: Slow down.,#FF7D40
0:05:05.35,0:05:07.50,[Nangong Jingnu helps Nangong Rang sit down],
0:05:10.17,0:05:11.79,Nangong Rang: All of you can go as well,,
0:05:12.44,0:05:14.76,do what you need to do.,
0:05:15.17,0:05:15.92,Guards: Understood.,
0:05:17.38,0:05:19.53,[The crowd leaves],
0:05:20.25,0:05:23.08,Nangong Rang: Sijiu, bring two coal basins here,,
0:05:23.83,0:05:26.38,and fetch a hand stove for the Princess as well.,
0:05:26.60,0:05:27.62,Sijiu: Understood.,
0:05:28.87,0:05:31.21,[Sijiu leads the rest of the servants out of the hall and closes the doors],
0:05:38.25,0:05:41.31,Nangong Rang: My child, I know that you are worried for Emperor Father,,
0:05:41.84,0:05:44.38,but you shouldn’t be so lightly dressed.,
0:05:45.20,0:05:47.66,There are still plenty of outside officials in this temporary palace…,
0:05:48.39,0:05:49.76,You are a young woman.,
0:05:52.90,0:05:54.24,Nangong Jingnu: Emperor Father is right.,#FF7D40
0:05:59.84,0:06:02.26,Nangong Rang: I have sworn to your Empress Mother,
0:06:02.86,0:06:08.03,that I will keep you safe, healthy, and happy for your entire life.,
0:06:09.36,0:06:12.44,But even as the Emperor…,
0:06:13.01,0:06:15.64,there are many things that I cannot help with.,
0:06:17.54,0:06:20.98,The brush of a recording official is as sharp as a blade!,
0:06:21.80,0:06:26.22,The people outside of the palace cannot see the good in you, my child.,
0:06:27.71,0:06:31.82,They are only able to conceive of a Zhenzhen Princess,
0:06:31.82,0:06:34.60,that is speculated on using only the limited observations,
0:06:35.47,0:06:38.63,written down by others.,
0:06:39.26,0:06:41.45,Nangong Jingnu: The life of a person is no more than a few decades.,#FF7D40
0:06:41.91,0:06:43.95,This daughter does not seek a lasting name in history,,#FF7D40
0:06:44.41,0:06:46.70,this daughter only wishes to be able to help Emperor Father,#FF7D40
0:06:47.01,0:06:49.14,and live harmoniously with my siblings.,#FF7D40
0:06:49.86,0:06:51.27,As for what future generations will say…,#FF7D40
0:06:51.65,0:06:53.77,This daughter can’t control it, or care about it!,#FF7D40
0:06:55.17,0:07:00.00,Nangong Rang: But Emperor Father will always have to go ahead of you in the end!,
0:07:00.95,0:07:02.03,Nangong Jingnu: Emperor Father!,#FF7D40
0:07:04.18,0:07:06.87,Nangong Rang: I have read your report.,
0:07:07.95,0:07:11.41,Your many siblings have seen the same sight,,
0:07:12.23,0:07:14.89,but you are the only one who spoke up to me about it.,
0:07:16.94,0:07:17.74,Nangong Jingnu: This daughter was just…,#FF7D40
0:07:17.74,0:07:19.91,Nangong Rang: Promise Emperor Father one thing.,
0:07:20.66,0:07:21.45,Nangong Jingnu: Yes.,#FF7D40
0:07:22.26,0:07:26.39,Nangong Rang: From now on… Keep the sharpness of your edge hidden.,
0:07:27.35,0:07:31.38,If there’s anything you wish to say, come and see Emperor Father in person.,
0:07:32.54,0:07:34.67,We will keep the conversation to ourselves.,
0:07:36.05,0:07:40.56,You must not let anyone other than Emperor Father know a hint of it.,
0:07:42.40,0:07:44.31,As for reports…,
0:07:44.89,0:07:46.02,If you must send them,,
0:07:46.80,0:07:49.96,it must be through people you can absolutely trust,,
0:07:49.96,0:07:52.01,and they are to deliver it straight to me.,
0:07:52.86,0:07:53.75,Do you understand?,
0:07:54.28,0:07:56.26,Nangong Jingnu: Yes, this daughter understands.,#FF7D40
0:07:59.79,0:08:02.37,Nangong Rang: My child has truly grown up,,
0:08:04.77,0:08:05.71,ai.,
0:08:21.67,0:08:23.89,[A few days later, on the road to the spring hunt],
0:08:23.89,0:08:25.95,[Inside the horse carriage],
0:08:26.53,0:08:28.58,Nangong Jingnu: How you been sleeping well these days, er-jie?,#FF7D40
0:08:30.23,0:08:33.24,Nangong Shunu: Who can get a good night’s sleep after such a big incident?,
0:08:35.00,0:08:35.87,Nangong Jingnu: That’s true.,#FF7D40
0:08:36.62,0:08:38.82,I thought we’d go straight back to the capital,,#FF7D40
0:08:39.23,0:08:43.00,but Emperor Father said that this year’s spring hunt is a must.,#FF7D40
0:08:44.84,0:08:46.67,Nangong Shunu: Emperor Father must have his own considerations.,
0:08:46.89,0:08:49.24,It is not our part as Princesses to comment on it.,
0:08:49.60,0:08:51.33,Nangong Jingnu: I just feel bad for Emperor Father.,#FF7D40
0:08:52.16,0:08:53.60,Er-jie saw it too, right?,#FF7D40
0:08:54.02,0:08:55.73,After a fire like that,,#FF7D40
0:08:56.05,0:08:57.95,although the ancestral tablets have been saved,,#FF7D40
0:08:58.12,0:08:59.40,the shrine is ruined.,#FF7D40
0:09:00.22,0:09:01.34,On the day of ancestral worship,,#FF7D40
0:09:01.53,0:09:04.98,Emperor Father told us to kneel outside while he went up there alone,,#FF7D40
0:09:05.69,0:09:08.80,and he stayed there in the pile of rubble for four hours.,#FF7D40
0:09:09.11,0:09:11.09,He must have been so sad, right?,#FF7D40
0:09:12.57,0:09:14.16,It’s just a spring hunt…,#FF7D40
0:09:14.52,0:09:16.00,It wouldn’t be any different if it happened this year or the next year.,#FF7D40
0:09:16.38,0:09:18.92,This won’t do, I have to go talk to Emperor Father.,#FF7D40
0:09:18.92,0:09:20.08,Nangong Shunu: Ai, xiao-mei~,
0:09:22.18,0:09:22.95,Brother-in-law,,
0:09:23.22,0:09:24.77,help me talk her out of this!,
0:09:26.02,0:09:27.54,Qi Yan: Your Highness’ filial piety is commendable,,#A9A0FF
0:09:27.66,0:09:29.24,His Majesty surely won’t be upset by it.,#A9A0FF
0:09:30.78,0:09:31.73,However…,#A9A0FF
0:09:33.10,0:09:35.29,the spring hunt really isn’t an event that can be cancelled just like that.,#A9A0FF
0:09:36.26,0:09:38.39,What follows the spring hunt is the lunar order for sowing seeds.,#A9A0FF
0:09:39.21,0:09:42.35,In the hearts of farmers, the spring hunt is a type of ritual,#A9A0FF
0:09:43.08,0:09:45.76,where the Emperor prays for blessings from heaven,,#A9A0FF
0:09:46.14,0:09:48.15,so that there will be a bountiful harvest in the following year.,#A9A0FF
0:09:49.16,0:09:50.51,His Majesty cares for the people,,#A9A0FF
0:09:50.73,0:09:53.70,he would rather go through the trouble himself to give the farmers peace of mind.,#A9A0FF
0:09:54.82,0:09:56.46,If Your Highness tries to coax His Majesty against the spring hunt,,#A9A0FF
0:09:56.75,0:09:58.53,won’t that put His Majesty on the spot?,#A9A0FF
0:10:00.49,0:10:01.60,Nangong Jingnu: Is that so?,#FF7D40
0:10:02.16,0:10:04.12,But isn’t the spring hunt a matter of killing?,#FF7D40
0:10:04.55,0:10:06.19,How can it be a prayer for blessings…,#FF7D40
0:10:07.52,0:10:08.73,That’s so strange.,#FF7D40
0:10:11.22,0:10:12.44,Nangong Shunu: Oh, you!,
0:10:28.58,0:10:31.39,[Ding province hunting grounds],
0:10:34.45,0:10:36.53,Nangong Rang: The sons of our great Wei kingdom!,
0:10:37.09,0:10:38.24,Officials/Princes: Your Majesty!/Emperor Father!,
0:10:38.75,0:10:42.04,Nangong Rang: Our great Wei kingdom is in need of capable men.,
0:10:42.66,0:10:45.76,Both the civil and martial arts are indispensable!,
0:10:46.82,0:10:50.56,Don’t hold yourselves back in today’s spring hunt, lads,,
0:10:51.05,0:10:53.22,show everyone what you’ve got!,
0:10:53.49,0:10:54.35,Officials and Princes: Yes!,
0:10:54.96,0:10:55.76,Nangong Rang: Bring me my bow!,
0:10:55.93,0:10:56.46,Eunuch: Understood.,
0:10:57.78,0:11:02.43,[A eunuch presents a bow and arrow, Nangong Rang shoots towards the sky],
0:11:03.83,0:11:04.40,Nangong Rang: Go for it!,
0:11:04.70,0:11:05.30,Officials and Princes: Go~!,
0:11:15.18,0:11:16.02,Nangong Wang: Go!,
0:11:17.04,0:11:19.43,The first place for this spring hunt will belong to no one else but me!,
0:11:20.01,0:11:21.91,Lu Zhongxing: It’s too early to say that, Third Highness.,
0:11:22.21,0:11:25.06,No son of the Lu family has ever lost in the hunting grounds!,
0:11:25.58,0:11:29.04,Nangong Wang: Alright then, let me learn whatever there is to learn from you, go!,
0:11:29.04,0:11:29.70,Lu Zhongxing: Go!,
0:11:41.12,0:11:42.60,Nangong Jingnu: Er-jie, let’s go too!,#FF7D40
0:11:43.82,0:11:45.52,Nangong Shunu: I can’t, I don’t know how to ride horses.,
0:11:45.81,0:11:47.33,You should go yourself, xiao-mei.,
0:11:47.66,0:11:49.24,Nangong Jingnu: We rarely get to come here,,#FF7D40
0:11:49.55,0:11:50.98,and there’s so much space to ride.,#FF7D40
0:11:50.98,0:11:52.11,Won’t you give it a try, er-jie?,#FF7D40
0:11:52.71,0:11:54.62,Nangong Shunu: I really do not like horseback archery,,
0:11:55.20,0:11:57.95,but maybe you could take the chance to teach brother-in-law a thing or two, meimei?,
0:11:59.47,0:12:00.42,Nangong Jingnu: Alright then,,#FF7D40
0:12:00.76,0:12:02.11,wait for us to come back, er-jie.,#FF7D40
0:12:02.50,0:12:04.06,Nangong Shunu: Mm, stay safe.,
0:12:04.24,0:12:04.72,Nangong Jingu: Mn.,
0:12:05.03,0:12:06.65,Nangong Shunu: Just run around the outer ring,,
0:12:06.74,0:12:08.31,do not ever enter the dense forest.,
0:12:08.53,0:12:10.68,I’ve heard that there are fierce animals inside.,
0:12:11.67,0:12:13.56,Nangong Jingnu: I know, don’t worry, er-jie.,#FF7D40
0:12:14.82,0:12:17.20,Nangong Jingnu: Qi Yan, hurry up.,#FF7D40
0:12:17.26,0:12:19.28,Qi Yan: Coming, coming…,#A9A0FF
0:12:20.05,0:12:21.40,Nangong Jingnu: Come on, I’ll take you to where the horses are,,#FF7D40
0:12:21.40,0:12:22.08,you can pick one for yourself.,#FF7D40
0:12:23.37,0:12:25.63,[The two of them run on the grass hand in hand],
0:12:25.73,0:12:27.01,Qi Yan: Is Your Highness not choosing one?,#A9A0FF
0:12:27.16,0:12:28.72,Nangong Jingnu: I have my own.,#FF7D40
0:12:28.72,0:12:30.56,See… It’s that white horse over there.,#FF7D40
0:12:31.72,0:12:33.31,Qi Yan: **A yuhuacong?**,#A9A0FF
0:12:34.24,0:12:36.80,**This breed of horse is famous for its docile nature…**,#A9A0FF
0:12:38.82,0:12:40.49,**Looks like I won’t have to worry.**,#A9A0FF
0:12:44.57,0:12:47.57,Nangong Lie: Why is xiao-mei moving so slowly like a steele-bearing tortoise today?,
0:12:48.22,0:12:49.50,Getting cold feet?,
0:12:50.39,0:12:51.10,Nangong Jingnu: Hmph.,#FF7D40
0:12:51.45,0:12:53.54,Nangong Lie: What? Lost your guts?,
0:12:54.23,0:12:57.69,Or is xiao-mei just too noble to remember a matter such as this?,
0:12:58.39,0:13:02.30,We had an agreement on the day of the Shangyuan festival…,
0:13:02.83,0:13:04.28,Nangong Jingnu: Who lost their guts? You…,#FF7D40
0:13:04.28,0:13:07.98,Qi Yan: Your Highness, didn’t you promise to teach this subject how to ride?,#A9A0FF
0:13:08.39,0:13:11.70,You also said that you won’t hunt this year, and that you’d only ride horses.,#A9A0FF
0:13:12.01,0:13:12.96,How will you compete, Your Highness?,#A9A0FF
0:13:14.41,0:13:15.15,Qi Yan: Your Highness…,#A9A0FF
0:13:15.42,0:13:18.46,In troubled times, it is better not to argue with the Sixth Highness,,#A9A0FF
0:13:18.85,0:13:20.25,or His Majesty will be saddened.,#A9A0FF
0:13:22.37,0:13:23.02,Nangong Jingnu: Let’s go!,#FF7D40
0:13:23.58,0:13:26.96,Nangong Lie: What? Scared? Running away?,
0:13:27.37,0:13:30.67,Qi Yan: Sixth Highness, His Majesty said earlier that,#A9A0FF
0:13:30.67,0:13:32.26,he wanted to see a show of skills.,#A9A0FF
0:13:33.24,0:13:34.89,If the Sixth Highness does not enter the hunting grounds soon,,#A9A0FF
0:13:35.11,0:13:36.75,you might lose the first opportunity.,#A9A0FF
0:13:38.12,0:13:38.60,Goodbye.,#A9A0FF
0:13:40.38,0:13:40.92,Nangong Lie: …Freak eyes!,
0:13:43.24,0:13:45.47,[Nangong Lie rides away],
0:13:47.15,0:13:50.23,Nangong Jingnu: Liu-ge is such a bummer, and we didn’t get to choose a horse…,#FF7D40
0:13:52.20,0:13:52.81,How about this,,#FF7D40
0:13:53.10,0:13:56.37, I’ll teach you the basics of horse ridings and give you a few demonstrations.,#FF7D40
0:13:56.89,0:14:00.32,Once you learn enough, I’ll get someone to bring a horse to you, alright?,#FF7D40
0:14:00.63,0:14:01.78,Qi Yan: Alright.,#A9A0FF
0:14:03.55,0:14:06.34,[Nangong Jingnu takes the reins and mounts the horse],
0:14:06.34,0:14:07.21,Nangong Jingnu: Heel…,#FF7D40
0:14:08.11,0:14:09.63,Qi Yan: **There’s something off about this horse!**,#A9A0FF
0:14:10.83,0:14:14.40,Nangong Jingnu: Don’t be scared, horses aren’t scary, they are very intelligent.,#FF7D40
0:14:14.93,0:14:16.68,It’s my fault for being out of practice,,#FF7D40
0:14:16.98,0:14:19.85,I must have caused it pain while I was mounting…,#FF7D40
0:14:20.25,0:14:21.76,It’s usually very docile.,#FF7D40
0:14:22.57,0:14:25.59,[Qi Yan walks up quickly and pats the horse’s neck soothingly],
0:14:27.84,0:14:28.77,Qi Yan: **Something’s wrong.**,#A9A0FF
0:14:29.35,0:14:32.66,**I’ve never met a horse that rejects my communication before…**,#A9A0FF
0:14:33.44,0:14:35.53,**Yuhuacong horses are famous for their obedience,**,#A9A0FF
0:14:36.67,0:14:38.21,**there’s something wrong with this horse!**,#A9A0FF
0:14:41.54,0:14:43.32,Nangong Jingnu: Qi Yan, what’s the matter?,#FF7D40
0:14:44.65,0:14:47.73,Qi Yan: This subject… This subject has never seen such a pretty horse.,#A9A0FF
0:14:48.20,0:14:50.55,It is completely snow-white, plump, and strong.,#A9A0FF
0:14:51.88,0:14:55.77,Your Highness… May this subject ride with Your Highness?,#A9A0FF
0:14:56.67,0:14:57.24,Nangong Jingnu: Huh?,#FF7D40
0:14:58.05,0:15:00.13,Qi Yan: Is that fine, Your Highness?,#A9A0FF
0:15:00.81,0:15:02.81,This subject is truly too afraid to ride a horse…,#A9A0FF
0:15:03.21,0:15:06.22,If this subject could share a horse with Your Highness, it wouldn’t be as frightening.,#A9A0FF
0:15:08.24,0:15:08.96,Nangong Jingnu: Oh…,#FF7D40
0:15:09.89,0:15:11.70,Well, alright then.,#FF7D40
0:15:12.63,0:15:14.28,[Nangong Jingnu reaches out and pulls Qi Yan up on the horse],
0:15:14.83,0:15:16.11,Nangong Jingnu: Heel…,#FF7D40
0:15:16.95,0:15:18.82,Good horse, don’t be scared, Xiao-Bai.,#FF7D40
0:15:19.11,0:15:21.20,Qi Yan is family, don’t be like that…,#FF7D40
0:15:23.81,0:15:25.24,[Qi Yan’s memory],
0:15:25.41,0:15:26.30,Qi Yan(young): Don’t be scared, Xiao-Die.,#A9A0FF
0:15:26.30,0:15:29.16,Flowing Fire recognizes family, it won’t buck you off.,#A9A0FF
0:15:29.49,0:15:33.50,Xiao-Die(young): Gege, I’m scared, gege, hold me…,
0:15:34.19,0:15:36.81,Qi Yan(young): It’s okay, don’t be scared, gege is here.,#A9A0FF
0:15:38.18,0:15:39.20,[Memory ends],
0:15:42.50,0:15:46.12,Nangong Jingnu: When… horse riding, you must relax, and believe in the horse…,#FF7D40
0:15:46.33,0:15:47.82,[Nangong Lie comes riding back and whips the yuhuacong],
0:15:47.82,0:15:48.55,Nangong Jingnu: Ah!,#FF7D40
0:15:51.14,0:15:54.03,Nangong Lie: Now things are getting interesting, yeah… Go~,
0:15:52.23,0:15:54.03,Nangong Jingnu: Stop right now, Xiao-Bai!,#FF7D40
0:15:59.80,0:16:00.69,Nangong Jingnu: Ah!,#FF7D40
0:16:04.31,0:16:05.24,Qi Yan: Your Highness!,#A9A0FF
0:16:05.83,0:16:09.44,Nangong Jingnu: Qi Yan, Qi Yan, save me… Ah!,#FF7D40
0:16:10.27,0:16:12.16,Qi Yan: **Someone tampered with this yuhuacong**,#A9A0FF
0:16:12.94,0:16:13.79,**but who could it be?**,#A9A0FF
0:16:14.19,0:16:15.36,**Who would target a Princess?**,#A9A0FF
0:16:16.92,0:16:18.77,**It won’t be hard to get this yuhuacong under control,**,#A9A0FF
0:16:19.26,0:16:22.87,**but… that’s not a skill that Qi Yan should have!**,#A9A0FF
0:16:24.25,0:16:27.14,**Damn it… Why aren’t the guards here yet?**,#A9A0FF
0:16:27.84,0:16:28.64,Qi Yan: Don’t be scared, Your Highness.,#A9A0FF
0:16:28.99,0:16:32.48,Hold on for a little longer, the guards— the guards will be here to save us very soon!,#A9A0FF
0:16:33.25,0:16:34.93,Nangong Jingnu: Ah!!!!,#FF7D40
0:16:35.37,0:16:38.38,Qi Yan: Your Highness, hold on to the reins, hold on tight!,#A9A0FF
0:16:39.95,0:16:41.10,[A tree branch strikes Qi Yan’s face],
0:16:42.66,0:16:43.18,Qi Yan: Tss…,#A9A0FF
0:16:47.73,0:16:50.72,Qi Yan: **The forest is getting denser, if this goes on…**,#A9A0FF
0:16:53.29,0:16:54.97,**The guards are still far away…**,#A9A0FF
0:16:56.42,0:16:58.55,Qi Yan: Your Highness, do you trust me?,#A9A0FF
0:16:58.77,0:16:59.29,Nangong Jingnu: Mn!,#FF7D40
0:17:00.64,0:17:01.88,Qi Yan: Take your feet out of the stirrups!,#A9A0FF
0:17:02.47,0:17:03.16,Nangong Jingnu: What?,#FF7D40
0:17:03.16,0:17:03.96,Qi Yan: Move out of the stirrups!,#A9A0FF
0:17:04.69,0:17:06.62,Nangong Jingnu: I can’t, I don’t dare to!,#FF7D40
0:17:07.11,0:17:09.29,Qi Yan: Don’t be scared, Your Highness, this subject is holding on to you…,#A9A0FF
0:17:12.03,0:17:13.60,[Nangong Jingnu moves out of the stirrups],
0:17:14.28,0:17:17.89,Qi Yan: Your Highness, please let go of the reins and hold onto this subject’s arm.,#A9A0FF
0:17:17.89,0:17:21.70,No matter what happens, do not let go, trust me!,#A9A0FF
0:17:23.47,0:17:25.84,Nangong Jingnu: Alright, ah!!!,#FF7D40
0:17:26.33,0:17:27.46,[Qi Yan pulls hard on the reins with one hand while squeezing the horse’s abdomen with her legs],
0:17:27.46,0:17:28.20,[The horse whinnies and raises its front legs],
0:17:28.20,0:17:28.97,Qi Yan: **Now!**,#A9A0FF
0:17:31.84,0:17:36.44,[Qi Yan uses the momentum to fall back while holding Nangong Jingnu],
0:17:46.17,0:17:46.86,Qi Yan: Your Highness?,#A9A0FF
0:17:47.54,0:17:48.36,Your Highness?,#A9A0FF
0:17:53.82,0:17:56.58,Qi Yan: No, it won’t do to stay like this.,#A9A0FF
0:17:59.45,0:18:04.09,[Qi Yan sets Nangong Jingnu aside gently, struggles to get up, then walks away],
0:18:13.71,0:18:17.55,[She tosses a handful of damp leaves into the fire],
0:18:24.27,0:18:26.14,Nangong Jingnu: (coughs from the smell of smoke),#FF7D40
0:18:26.67,0:18:27.73,Qi Yan: Your Highness, you’re awake?,#A9A0FF
0:18:29.86,0:18:30.58,Nangong Jingnu: Ah!,#FF7D40
0:18:31.76,0:18:33.09,You actually pulled me…,#FF7D40
0:18:34.93,0:18:35.84,Your face?,#FF7D40
0:18:36.05,0:18:38.23,Your face… What happened?,#FF7D40
0:18:38.89,0:18:41.65,Qi Yan: It was probably from a tree branch, this subject was just careless.,#A9A0FF
0:18:42.00,0:18:43.00,It’s fine.,#A9A0FF
0:18:43.56,0:18:46.39,[Nangong Jingnu gets up and moves to sit down next to Qi Yan],
0:18:47.09,0:18:48.39,Nangong Jingnu: How is this fine?,#FF7D40
0:18:49.13,0:18:50.66,It’s such a deep wound.,#FF7D40
0:18:51.17,0:18:54.15,If it was any higher, you’d have lost your left eye!,#FF7D40
0:18:55.46,0:18:57.27,Where else were you hurt?,#FF7D40
0:18:57.27,0:18:58.67,Let me see?,#FF7D40
0:18:59.95,0:19:01.28,Qi Yan: It’s fine, really.,#A9A0FF
0:19:01.84,0:19:03.34,You should move your limbs around, Your Highness.,#A9A0FF
0:19:03.76,0:19:05.19,See if there are any places that hurt.,#A9A0FF
0:19:09.41,0:19:11.37,Nangong Jingnu: You risked your life to protect me,,#FF7D40
0:19:12.87,0:19:14.83,how could I be hurt?,#FF7D40
0:19:17.83,0:19:19.27,Qi Yan: It’s fine as long as Your Highness is alright.,#A9A0FF
0:19:20.10,0:19:21.60,Nangong Jingnu: Where are you hurt?,#FF7D40
0:19:21.60,0:19:22.94,Please tell me…,#FF7D40
0:19:25.75,0:19:27.49,Qi Yan: **I’ve used you for my plans again and again,**,#A9A0FF
0:19:29.08,0:19:30.89,**yet you’re concerned for me instead…**,#A9A0FF
0:19:33.01,0:19:35.55,Nangong Jingnu: Say something, where are you hurt?,#FF7D40
0:19:35.55,0:19:37.21,Don’t lie to me…,#FF7D40
0:19:39.76,0:19:43.38,Nangong Jingnu: I’m sorry, I shouldn’t have tried to show off,,#FF7D40
0:19:44.49,0:19:48.27,I’m actually not very good at riding…,#FF7D40
0:19:53.46,0:19:54.24,Qi Yan: Your Highness.,#A9A0FF
0:19:55.28,0:19:55.89,Nangong Jingnu: Hmm?,#FF7D40
0:19:57.57,0:20:00.48,Qi Yan: Your Highness, this subject is a little cold.,#A9A0FF
0:20:02.72,0:20:05.52,Nangong Jingnu: Wait for a moment, I’ll go and gather more branches.,#FF7D40
0:20:06.83,0:20:07.65,Qi Yan: Your Highness.,#A9A0FF
0:20:08.02,0:20:08.93,Nangong Jingnu: What’s wrong?,#FF7D40
0:20:11.04,0:20:14.55,Qi Yan: Your Highness, can you hug this subject?,#A9A0FF
0:20:16.87,0:20:17.52,Nangong Jingnu: Alright.,#FF7D40
0:20:22.88,0:20:24.30,[Qi Yan leans on Nangong Jingnu’s shoulder],
0:20:26.50,0:20:27.23,Nangong Jingnu: What’s wrong?,#FF7D40
0:20:27.90,0:20:29.23,Where does it hurt?,#FF7D40
0:20:31.67,0:20:35.46,Qi Yan: …This subject, this subject was just a little tired.,#A9A0FF
0:20:37.86,0:20:39.26,Nangong Jingnu: Then I won’t move,,#FF7D40
0:20:39.66,0:20:43.01,just lean on me and get some rest.,#FF7D40
0:20:45.78,0:20:46.56,Qi Yan: …Alright,,#A9A0FF
0:20:48.60,0:20:51.98,it’s just us, get some rest.,#A9A0FF
0:21:02.53,0:21:08.18,Nangong Jingnu: Say… Could it be that our eight numbers of birth don’t match?,#FF7D40
0:21:09.69,0:21:13.56,You’re always getting sick or injured when you’re with me…,#FF7D40
0:21:17.05,0:21:18.52,Qi Yan: Why would Your Highness say that?,#A9A0FF
