开始时间,结束时间,字幕内容,字幕颜色
0:21:19.57,0:21:21.63,Hasn’t it already been calculated by the soothsaying division?,#A9A0FF
0:21:22.09,0:21:25.31,The eight numbers of this subject and Your Highness have six matches.,#A9A0FF
0:21:25.80,0:21:28.73,A fate that is mutually benefitting, and a life-long partnership.,#A9A0FF
0:21:31.53,0:21:32.37,Nangong Jingnu: Really?,#FF7D40
0:21:33.81,0:21:34.77,Is that so…,#FF7D40
0:21:37.01,0:21:40.82,Qi Yan: **It’s a shame that I am not Qi Yan…**,#A9A0FF
0:21:43.96,0:21:46.39,Qi Yan: Remember to scatter damp leaves in the fire, Your Highness.,#A9A0FF
0:21:46.58,0:21:49.14,When the guards see it, they will come right away.,#A9A0FF
0:21:49.83,0:21:51.57,Nangong Jingnu: Mn, I got it.,#FF7D40
0:21:51.78,0:21:53.10,You should rest for a while.,#FF7D40
0:21:53.66,0:21:54.16,Qi Yan: Mn.,#A9A0FF
0:21:55.09,0:21:58.04,Remember to wake me when the guards come, Your Highness.,#A9A0FF
0:21:58.70,0:21:59.98,Nangong Jingnu: Alright.,#FF7D40
0:22:02.23,0:22:05.97,Qi Yan: Your Highness… Promise this subject one more thing.,#A9A0FF
0:22:07.21,0:22:08.10,Nangong Jingnu: Tell me.,#FF7D40
0:22:10.11,0:22:11.34,Qi Yan: If His Majesty asks,,#A9A0FF
0:22:12.39,0:22:15.33,please do not expose the Sixth Highness…,#A9A0FF
0:22:15.33,0:22:16.12,Alright?,#A9A0FF
0:22:17.52,0:22:20.28,Nangong Jingnu: Alright, I promise.,#FF7D40
0:22:39.82,0:22:44.71,[Nangong Rang paces back and forth],
0:22:46.33,0:22:49.89,Nangong Rang: Why aren’t they back yet, have they still not found the Princess?,
0:22:52.62,0:22:54.41,Sijiu: Your Majesty, Your Majesty,,
0:22:55.44,0:22:57.83,the Zhenzhen Highness has returned safely!,
0:22:59.89,0:23:02.43,Nangong Rang: Call the imperial doctor, tell him to come with me!,
0:23:03.12,0:23:05.80,Sijiu: Understood, summon imperial doctor Ding at once.,
0:23:13.18,0:23:14.16,Nangong Shunu: Don’t worry, xiao-mei,,
0:23:14.65,0:23:15.95,the imperial doctor has already been summoned.,
0:23:16.74,0:23:19.83,Although brother-in-law… looks…,
0:23:20.08,0:23:22.90,There aren’t any injuries to critical areas after all,,
0:23:23.43,0:23:25.89,so his life is in no danger.,
0:23:26.52,0:23:28.71,Nangong Jingnu: When we were in the forest, he could still talk to me,,#FF7D40
0:23:29.57,0:23:32.35,he said that he was tired and he wanted to sleep for a while,,#FF7D40
0:23:33.06,0:23:37.58,but I couldn’t wake him when the guards arrived,,#FF7D40
0:23:37.73,0:23:41.20,er-jie… What should I do?,#FF7D40
0:23:41.45,0:23:43.03,Guards: Greetings to Your Majesty.,
0:23:46.06,0:23:47.17,Nangong Shunu: Greetings to Emperor Father.,
0:23:47.80,0:23:49.02,Nangong Jingnu: Emperor Father,,#FF7D40
0:23:50.16,0:23:50.92,Qi Yan, he…,#FF7D40
0:23:50.92,0:23:54.81,Nangong Rang: Don’t be scared, Emperor Father is here… Emperor Father is here.,
0:23:56.18,0:23:57.93,Are you hurt anywhere, my child?,
0:23:58.08,0:24:01.07,Emperor Father has brought the imperial doctor, let him take a look at you?,
0:24:02.82,0:24:03.84,Nangong Jingnu: This daughter is fine!,#FF7D40
0:24:04.56,0:24:06.98,Imperial doctor Ding, take a look at Fuma quickly!,#FF7D40
0:24:07.23,0:24:07.79,Ding You: Understood!,
0:24:12.29,0:24:14.00,Nangong Rang: What on earth happened?,
0:24:15.06,0:24:16.76,Nangong Jingnu: This daughter wasn’t good at horse riding,,#FF7D40
0:24:17.40,0:24:20.08,but this daughter insisted on teaching Qi Yan how to ride horses.,#FF7D40
0:24:21.06,0:24:22.69,We rode on the same horse…,#FF7D40
0:24:23.15,0:24:24.65, In the end, I think…,#FF7D40
0:24:25.46,0:24:29.26,there was something like a snake in the grass,,#FF7D40
0:24:29.56,0:24:30.97,and it startled the yuhuacong.,#FF7D40
0:24:31.34,0:24:34.55,Xiao-Bai ran into the dense forest, carrying us with it.,#FF7D40
0:24:34.94,0:24:40.57,Thanks to Qi Yan cushioning this daughter with his own body in the nick of time,,#FF7D40
0:24:41.26,0:24:44.00,this daughter remained unharmed…,#FF7D40
0:24:46.67,0:24:47.46,Nangong Rang: Sijiu,,
0:24:48.43,0:24:52.15, hand all of the Princess’ guards to the Ministry of Penalty.,
0:24:52.15,0:24:52.96,Sijiu: Understood.,
0:24:53.16,0:24:54.80,Nangong Jingnu: Sijiu gonggong, please wait…,#FF7D40
0:24:56.43,0:24:57.21,Nangong Jingnu: Emperor Father,,#FF7D40
0:24:57.82,0:25:01.36,this daughter’s yuhuacong is a one-in-a-hundred treasure horse.,#FF7D40
0:25:01.85,0:25:04.52,The guards only had yellow-mane horses,,#FF7D40
0:25:04.69,0:25:06.27,how could they possibly have caught up?,#FF7D40
0:25:07.61,0:25:09.67,Considering that this daughter was not actually harmed,,#FF7D40
0:25:10.29,0:25:11.64,please forgive them.,#FF7D40
0:25:16.58,0:25:19.02,Nangong Rang: Since my child is pleading for them,,
0:25:19.76,0:25:21.23,I will not pursue this further.,
0:25:23.15,0:25:25.24,Fuma has done a great service protecting my child,,
0:25:25.78,0:25:28.01,I will definitely grant him great rewards!,
0:25:29.98,0:25:30.72,Nangong Jingnu: …Emperor Father.,#FF7D40
0:25:32.82,0:25:36.53,Nangong Rang: Emperor Father is relieved to see my child safe and sound.,
0:25:37.61,0:25:39.08,I will be returning now.,
0:25:39.51,0:25:40.01,Nangong Jingnu: Mm.,#FF7D40
0:25:41.41,0:25:42.66,Respectfully sending Emperor Father.,#FF7D40
0:25:43.03,0:25:44.30,Nangong Shunu: Respectfully sending Emperor Father.,
0:25:50.42,0:25:51.98,Guards: Respectfully sending Your Majesty.,
0:25:52.81,0:25:53.77,[Nangong Jingnu approaches the bedside],
0:25:53.77,0:25:56.18,Nangong Jingnu: Imperial doctor Ding, how is Qi Yan?,#FF7D40
0:25:57.77,0:26:00.94,Ding You: **Pretending to be unconscious, what else?**,
0:26:03.90,0:26:06.81,**I say… If you don’t wake up now,**,
0:26:07.80,0:26:11.10,**I’ll have to undress you to examine your injuries.**,
0:26:12.94,0:26:13.60,Ding You: Answering Your Highness,,
0:26:14.28,0:26:16.76,Lord Fuma is physically weak and has fainted from exhaustion.,
0:26:17.33,0:26:20.58,This subject will provide acupuncture and treat the wounds on Lord Fuma’s back now.,
0:26:20.87,0:26:21.84,Nangong Shunu: Let’s go, xiao-mei.,
0:26:22.13,0:26:22.96,We can come back later.,
0:26:23.49,0:26:25.43,Eunuch: The Fifth Highness is here.,
0:26:26.74,0:26:27.87,Nangong Shunu: Wu-ge is here,,
0:26:28.21,0:26:29.99,he must have heard about what happen and came to visit.,
0:26:31.29,0:26:33.34,Nangong Jingnu: Let’s go outside, er-jie.,#FF7D40
0:26:40.76,0:26:42.19,Ding You: Everyone has left,,
0:26:42.90,0:26:44.13,how long are you going to keep up the act?,
0:26:46.86,0:26:47.40,Qi Yan: Tss…,#A9A0FF
0:26:50.35,0:26:51.66,It really hurts.,#A9A0FF
0:26:53.90,0:26:55.41,Ding You: You knew it would hurt yet you still…,
0:26:58.23,0:27:00.00,Considering your skill with horses,,
0:27:00.64,0:27:02.25,how did you end up in such a mess?,
0:27:06.12,0:27:07.87,Qi Yan: That’s Aguna’s skill,,#A9A0FF
0:27:09.33,0:27:10.61,and Aguna is already dead.,#A9A0FF
0:27:11.63,0:27:13.04,Ding You: And why did you pretend to be unconscious?,
0:27:13.88,0:27:14.99,Your injury is on your back,,
0:27:15.33,0:27:17.84,what if old thief Nangong decided to stay and watch?,
0:27:19.07,0:27:22.03,You have always refused to get rid of the Jing kingdom royal tattoo on your chest.,
0:27:22.34,0:27:25.14,If they saw it, you’re beyond dead!,
0:27:29.64,0:27:33.41,Qi Yan: I’m not that important to warrant a personal visit from Nangong Rang.,#A9A0FF
0:27:34.77,0:27:36.11,Since Nangong Jingnu is fine,,#A9A0FF
0:27:36.40,0:27:37.82,he naturally wouldn’t stay for long.,#A9A0FF
0:27:38.64,0:27:39.57,And besides…,#A9A0FF
0:27:40.60,0:27:41.82,if I was awake,,#A9A0FF
0:27:42.19,0:27:44.77,I won’t be able to avoid a barrage of questions from old thief Nangong.,#A9A0FF
0:27:45.62,0:27:48.92,Nangong Jingnu’s yuhuacong has been tampered with,,#A9A0FF
0:27:49.48,0:27:53.90,but the person who escalated the situation to the point of danger was the Sixth Prince Nangong Lie.,#A9A0FF
0:27:55.49,0:27:57.64,So many pairs of eyes were watching at that time,,#A9A0FF
0:27:58.48,0:28:02.73,old thief Nangong will learn this if he just asked around.,#A9A0FF
0:28:03.21,0:28:04.50,What do you want me to say?,#A9A0FF
0:28:06.25,0:28:08.92,Hiding information would be deception to the Emperor,,#A9A0FF
0:28:09.42,0:28:13.22,but speaking the truth would offend that troublesome Nangong Lie,,#A9A0FF
0:28:15.06,0:28:16.52,so I might as well pretend to be unconscious.,#A9A0FF
0:28:16.99,0:28:19.01,Ding You: You sure are calculating.,
0:28:21.66,0:28:26.83,Aiya, and that poor Zhenzhen Princess was weeping so much for you…,
0:28:30.48,0:28:34.62,Ding You: I guess it’s fine, let the Nangong siblings fight among themselves.,
0:28:36.96,0:28:39.97,But I have to ask… why did you endanger yourself to save her?,
0:28:40.92,0:28:43.22,Since Nangong Lie is there to take the blame for this,,
0:28:43.22,0:28:45.36,why didn’t you use this chance to get rid of Nangong Jingnu,
0:28:45.36,0:28:47.61,and eliminate the potential threat of exposure?,
0:28:48.01,0:28:51.04,You might even be able to break free from the status of Fuma!,
0:28:51.50,0:28:53.28,Qi Yan: If Nangong Jingnu died,,#A9A0FF
0:28:53.81,0:28:56.03,do you think Nangong Rang will let me live?,#A9A0FF
0:28:57.52,0:28:58.89,Although I can’t participate in politics,,#A9A0FF
0:28:59.42,0:29:00.73,the status of Fuma,#A9A0FF
0:29:01.14,0:29:03.49,does give me certain conveniences that court officials do not have.,#A9A0FF
0:29:04.93,0:29:06.50,Qi Yan: Speaking of calculating,,#A9A0FF
0:29:08.12,0:29:08.71,hum…,#A9A0FF
0:29:09.97,0:29:13.22,Ding You, leave a bottle of medicinal alcohol for me.,#A9A0FF
0:29:14.16,0:29:14.72,Ding You: You…,
0:29:16.87,0:29:18.82,You want Nangong Jingnu to apply medicine on you?,
0:29:19.24,0:29:19.92,Are you crazy?,
0:29:20.81,0:29:23.35,Qi Yan: Don’t worry, the wound is on my back.,#A9A0FF
0:29:24.35,0:29:26.62,Even though she appears to be someone who fears nothing from the heavens to the earth,,#A9A0FF
0:29:27.12,0:29:28.71,she is actually very courteous.,#A9A0FF
0:29:29.36,0:29:31.06,She won’t look at anything that she shouldn’t.,#A9A0FF
0:29:34.63,0:29:35.45,You’re right,,#A9A0FF
0:29:36.51,0:29:38.89,the identity of a female Fuma will always be a problem,,#A9A0FF
0:29:40.19,0:29:42.90,so I need someone to be a witness for my identity.,#A9A0FF
0:29:43.43,0:29:45.08,Ding You: This is too risky!,
0:29:45.96,0:29:47.36,Even though you’ve taken drugs,,
0:29:47.49,0:29:50.51,there are still differences between the bone structures of men and women, you…,
0:29:50.51,0:29:53.93,Qi Yan: Does any of my goals not require walking on the knife’s edge?,#A9A0FF
0:29:55.49,0:29:57.04,I am well aware of what I’m doing.,#A9A0FF
0:29:58.10,0:30:00.17,Put the medicine down, and let her in.,#A9A0FF
0:30:00.50,0:30:01.54,Ding You: Qi Yan!,
0:30:02.10,0:30:03.21,Qi Yan: You can go now,,#A9A0FF
0:30:04.72,0:30:05.52,thanks.,#A9A0FF
0:30:11.54,0:30:12.31,Qi Yan: Oh right,,#A9A0FF
0:30:13.19,0:30:16.12, I’ll trouble you to give Shifu a message.,#A9A0FF
0:30:18.43,0:30:19.27,Ding You: Alright.,
0:30:19.57,0:30:23.53,Qi Yan: Nangong Jingnu is the only person I can rely on, do not touch her!,#A9A0FF
0:30:25.03,0:30:28.66,The only one who can kill her… is me!,#A9A0FF
0:30:39.64,0:30:40.78,Nangong Da: Xiao-mei~,
0:30:42.60,0:30:43.66, Are you alright?,
0:30:44.31,0:30:46.28,I heard people saying that you fell from a horse?,
0:30:47.15,0:30:47.83,Nangong Shunu: Wu-ge.,
0:30:48.26,0:30:50.29,Nangong Jingnu: Wu-ge, I’m fine,,#FF7D40
0:30:50.63,0:30:52.65,it’s all thanks to Qi Yan risking himself to protect me.,#FF7D40
0:30:52.91,0:30:54.00,He’s hurt.,#FF7D40
0:30:54.33,0:30:56.95,Nangong Da: Oh~ Is brother-in-law doing alright?,
0:30:57.79,0:30:59.58,I have brought with me some medical ingredients from the capital city,,
0:30:59.94,0:31:02.94,let the imperial doctor see if there’s anything that can be used for brother-in-law.,
0:31:03.28,0:31:04.31,Nangong Jingnu: Thank you, wu-ge.,#FF7D40
0:31:04.74,0:31:06.80,You have poor health, and the journey is rough…,#FF7D40
0:31:07.08,0:31:07.93,These medicines…,#FF7D40
0:31:09.20,0:31:11.35,Nangong Da: It’s fine, this leg of mine…,
0:31:12.19,0:31:13.94,It’s a problem that I’ve lived with my whole life,,
0:31:14.58,0:31:16.43,one missed dose of medicine is no problem at all.,
0:31:16.95,0:31:18.20,Brother-in-law needs it more right now.,
0:31:19.46,0:31:20.51,Nangong Jingnu: Thank you, wu-ge.,#FF7D40
0:31:21.04,0:31:25.09,Nangong Da: I remember that yuhuacong of yours being a treasure horse offered as a tribute by the northern provinces.,
0:31:25.49,0:31:26.96,It’s docile and intelligent,,
0:31:27.56,0:31:28.88,how did it go berserk?,
0:31:30.55,0:31:31.47,Nangong Jingnu: Ai…,#FF7D40
0:31:33.01,0:31:34.38,Nangong Shunu: There was a snake in the grass.,
0:31:35.00,0:31:37.42,The horse must have gone berserk after getting bitten by it.,
0:31:37.99,0:31:40.60,After all… the hunting grounds can’t compare to the stud farm in the capital.,
0:31:42.50,0:31:43.90,Nangong Da: Brother-in-law is a good person, the heavens will protect him.,
0:31:44.40,0:31:45.24,He will be fine.,
0:31:46.45,0:31:47.82,Don’t be too saddened, xiao-mei.,
0:31:48.58,0:31:50.13,The return to the palace is still days away.,
0:31:50.82,0:31:51.69,If you fall sick,,
0:31:52.25,0:31:53.53,you’ll have a rough time on the way back.,
0:31:54.41,0:31:54.96,Nangong Jingnu: Mm.,#FF7D40
0:31:57.31,0:31:58.17,Ding You: The Three Highness.,
0:31:59.29,0:32:00.51,Nangong Jingnu: How is Qi Yan?,#FF7D40
0:32:01.91,0:32:02.98,Ding You: Answering the Zhenzhen Highness,,
0:32:03.50,0:32:04.84,after receiving acupuncture from this subject,,
0:32:05.24,0:32:06.27,Lord Fuma is now awake.,
0:32:07.12,0:32:08.21,Nangong Jingnu: I’ll go and see him!,#FF7D40
0:32:08.21,0:32:08.98,Ding You: Your Highness, please wait!,
0:32:10.17,0:32:10.92,Nangong Jingnu: What’s wrong?,#FF7D40
0:32:11.51,0:32:13.29,Isn’t Qi Yan already awake?,#FF7D40
0:32:13.63,0:32:16.52,Nangong Da: Don’t rush, xiao-mei, let imperial doctor Ding finish.,
0:32:16.81,0:32:20.51,Ding You: Your Highness, Lord Fuma is very weak right now.,
0:32:21.10,0:32:22.79,And because of the shock,,
0:32:22.79,0:32:25.27,Lord Fuma needs some peace and quiet to stabilize the mind and spirit.,
0:32:26.27,0:32:27.89,It would be best if,,
0:32:29.35,0:32:30.76,for the next half a month…,
0:32:30.76,0:32:32.51,no one other than Your Highness visits Lord Fuma,,
0:32:33.19,0:32:34.77,or nightmares could become an issue.,
0:32:36.95,0:32:37.95,Additionally…,
0:32:38.66,0:32:41.13,Lord Fuma has a large bruise over the back.,
0:32:41.95,0:32:43.60,This subject has left behind a bottle of bruise alcohol,,
0:32:44.35,0:32:46.09,it needs to be applied on the mornings and evenings every day.,
0:32:46.73,0:32:48.10,May the Zhenzhen Highness…,
0:32:48.35,0:32:49.39,Nangong Jingnu: Alright.,#FF7D40
0:32:50.55,0:32:52.43,Ding You: Then this subject will be leaving to work on a prescription now,,
0:32:53.40,0:32:53.94,please excuse this subject.,
0:32:54.19,0:32:55.78,Nangong Jingnu: Mn, I’ll trouble you.,#FF7D40
0:32:57.40,0:32:59.88,Nangong Da: I’m relieved that brother-in-law is awake.,
0:33:00.63,0:33:03.38,Since he needs peace and quiet, I won’t be bothering him.,
0:33:04.22,0:33:06.33,Ask imperial doctor Ding to head to my place later to see,
0:33:06.65,0:33:08.43,if there are any medical ingredients he can use.,
0:33:09.07,0:33:10.19,Don’t brush yourself off either, xiao-mei,,
0:33:10.78,0:33:13.77,let imperial doctor Ding write a calming prescription for you,,
0:33:14.31,0:33:16.18,and when night falls, light some soothing incense.,
0:33:16.84,0:33:18.39,It’ll be good for both you and brother-in-law.,
0:33:19.07,0:33:20.97,Nangong Shunu: Mn, wu-ge is right.,
0:33:21.26,0:33:22.25,Did you catch all of that, xiao-mei?,
0:33:22.50,0:33:23.96,Nangong Jingnu: Mm, I got it.,#FF7D40
0:33:24.22,0:33:26.33,Thank you wu-ge, thank you er-jie.,#FF7D40
0:33:27.42,0:33:30.17,Nangong Shunu: Why say that when we’re all siblings here?,
0:33:31.14,0:33:33.07,Alright then, I’ll be leaving with wu-ge now.,
0:33:33.16,0:33:35.39,Nangong Jingnu: Mn, I’ll be staying then.,#FF7D40
0:33:36.99,0:33:39.36,Nangong Da: No need to see us out, xiao-mei, we’re leaving now.,
0:33:44.44,0:33:46.25,[Nangong Jingnu enters the inner compartment],
0:33:46.55,0:33:48.18,Nangong Jingnu: Qi Yan, you…,#FF7D40
0:33:50.66,0:33:51.70,Qi Yan: Your Highness.,#A9A0FF
0:33:52.79,0:33:56.49,Nangong Jingnu: Why, why are you… not wearing clothes?,#FF7D40
0:33:58.04,0:33:59.47,Qi Yan: This subject’s back is injured…,#A9A0FF
0:34:00.00,0:34:04.43,Nangong Jingnu: Oh, I, I, imperial doctor Ding said that… I should, I…,#FF7D40
0:34:05.71,0:34:08.10,Qi Yan: Then… sorry to trouble Your Highness.,#A9A0FF
0:34:08.39,0:34:09.70,Will you administer the medicine for this subject?,#A9A0FF
0:34:13.38,0:34:15.56,Nangong Jingnu: …Mn, alright.,#FF7D40
0:35:06.95,0:35:12.30,Jingnu: You, my first love, my forever,#FF7D40
0:35:12.30,0:35:15.47,the ocean depths, the searing flame,#FF7D40
0:35:15.47,0:35:19.89,sincerity, and illusion,#FF7D40
0:35:19.89,0:35:25.15,I, fell for you, made mistakes,#FF7D40
0:35:25.15,0:35:28.25,sated my thirst, lost my mind,#FF7D40
0:35:28.25,0:35:32.87,what I sowed, I reaped,#FF7D40
0:35:35.87,0:35:40.97,Qi Yan: You, in the court, by my pillow,#A9A0FF
0:35:40.97,0:35:44.37,the diverging path, in my heart,#A9A0FF
0:35:44.37,0:35:48.55,before my eyes, in the horizon,#A9A0FF
0:35:48.55,0:35:53.60,I, can't break free, can't linger,#A9A0FF
0:35:53.60,0:35:57.08,can't hate, can't understand,#A9A0FF
0:35:57.08,0:36:02.01,can't decide, can't take a side,#A9A0FF
0:36:03.06,0:36:07.58,My heart, is already wrung apart,#A9A0FF
0:36:07.58,0:36:09.44,ground to dust,#A9A0FF
0:36:09.44,0:36:15.83,There is no room for regret in a path towards a dead end,#A9A0FF
0:36:15.83,0:36:20.33,Jingnu: My love, fallen with my tear,#FF7D40
0:36:20.33,0:36:22.18,No one to blame,#FF7D40
0:36:22.18,0:36:28.61,Except me for a true love wrongly given,#FF7D40
0:36:41.16,0:36:46.67,Qi Yan: The path, no looking ahead, no looking back,#A9A0FF
0:36:46.67,0:36:49.97,no hesitation, no way back,#A9A0FF
0:36:49.97,0:36:54.22,no calculation, no letting go,#A9A0FF
0:36:54.22,0:37:08.62,Jingnu: Sigh, at the battle, the pain, the love, the dream, the show, all for naught,#FF7D40
0:37:08.62,0:37:13.26,Together: My heart, is already wrung apart,
0:37:13.26,0:37:15.12,ground to dust,
0:37:15.12,0:37:21.46,There is no room for regret in a path towards a dead end,
0:37:21.46,0:37:26.01,My love, fallen with my tear,
0:37:26.01,0:37:27.96,No one to blame,
0:37:27.96,0:37:33.95,Except me for a true love wrongly given,
0:37:33.95,0:37:38.99,Qi Yan: My heart, is already wrung apart,#A9A0FF
0:37:38.99,0:37:40.58,ground to dust,#A9A0FF
0:37:40.58,0:37:47.06,There is no room for regret in a path towards a dead end,#A9A0FF
0:37:47.06,0:37:51.49,Jingnu: My love, fallen with my tear,#FF7D40
0:37:51.49,0:37:53.45,No one to blame,#FF7D40
0:37:53.45,0:37:59.77,Except me for a true love wrongly given,#FF7D40
0:37:59.77,0:38:04.68,Together: My heart(heart), is already wrung apart,
0:38:04.68,0:38:06.37,ground to dust,
0:38:06.37,0:38:12.58,There is no room for regret in a path towards a dead end,
0:38:12.58,0:38:17.31,My love(love), fallen with my tear,
0:38:17.31,0:38:18.92,No one to blame,
0:38:18.92,0:38:25.56,Except me for a true love wrongly given,
0:38:25.56,0:38:35.78,I'll return to you in another life, and try again,