开始时间,结束时间,字幕内容,字幕颜色
0:24:01.62,0:24:02.80,Though…,
0:24:03.22,0:24:07.22,to have sold your writing as a scholar, that will get you criticized.,
0:24:08.57,0:24:11.90,Qi Yan: That will depend on whether or not third royal brother speak of this to others.,#A9A0FF
0:24:12.55,0:24:15.45,If the Third Highness says nothing, no one will know.,#A9A0FF
0:24:17.45,0:24:18.72,Nangong Wang: Hahaha.,
0:24:19.62,0:24:20.90,Qi Yan: Haha…,#A9A0FF
0:24:21.72,0:24:22.87,Nangong Wang: Great!,
0:24:24.35,0:24:25.37,Brother-in-law…,
0:24:25.95,0:24:27.65,Tell me why you’re here.,
0:24:29.97,0:24:33.25,Qi Yan: Everyone knows that Qi Yan has reached the skies in one step,,#A9A0FF
0:24:34.10,0:24:36.37,but who knows of the bitterness in my heart?,#A9A0FF
0:24:38.25,0:24:41.32,One that should have gone to the jade tree beyond the mortal world,,#A9A0FF
0:24:41.72,0:24:44.40,to wear illustrious clothes and ascend the phoenix tower.,#A9A0FF
0:24:45.42,0:24:48.47,A talent that reaches the height of clouds,,#A9A0FF
0:24:49.12,0:24:52.45,a lifetime of aspiration yet to be freed…,#A9A0FF
0:24:53.97,0:24:56.87,Does third royal brother feel the same?,#A9A0FF
0:24:59.10,0:25:02.95,Nangong Wang: Such talk is taboo, brother-in-law.,
0:25:05.55,0:25:08.02,Qi Yan: If third royal brother has no great ambition at all,,#A9A0FF
0:25:08.35,0:25:10.45,consider this a misjudgment on my part.,#A9A0FF
0:25:10.87,0:25:11.90,I’ll excuse myself.,#A9A0FF
0:25:12.40,0:25:17.35,Xie An: Whoa, worthy brother, please do not be angry, anger harms the body.,
0:25:18.22,0:25:20.10,Sit down, sit down.,
0:25:20.57,0:25:21.77,[Qi Yan sits down],
0:25:22.20,0:25:25.60,Nangong Wang: You can go, I will talk to brother-in-law alone.,
0:25:26.12,0:25:26.90,Xie An: Understood.,
0:25:28.72,0:25:31.05,[Xie An leaves],
0:25:42.82,0:25:46.60,Nangong Wang: You are the Fuma of our great Wei kingdom’s only legitimate Princess.,
0:25:47.37,0:25:49.22,Are you still discontent in some way?,
0:25:50.45,0:25:51.65,Qi Yan: Ai…,#A9A0FF
0:25:53.55,0:25:57.25,It is a fortune of three lifetimes to enter His Majesty’s good graces,,#A9A0FF
0:25:57.77,0:26:00.22,and Her Highness is a beautiful woman rare among the world as well.,#A9A0FF
0:26:01.70,0:26:04.82,It’s just a shame that my aspiration lies somewhere else.,#A9A0FF
0:26:06.17,0:26:08.25,For a big man to walk on this world,,#A9A0FF
0:26:08.57,0:26:11.55,one must naturally create a career with their own ability.,#A9A0FF
0:26:12.75,0:26:17.20,Even if it does not make a mark in history, one must still have an indomitable spirit.,#A9A0FF
0:26:18.70,0:26:21.35,Nangong Wang: High positions and riches are easily gotten.,
0:26:22.07,0:26:24.87,What’s most rare are flowers who understand.,
0:26:26.22,0:26:29.80,Qi Yan: The stabled old horse still longs to gallop a thousand miles;,#A9A0FF
0:26:30.30,0:26:33.85,the noble-hearted old man still holds immeasurable aspiration.,#A9A0FF
0:26:36.87,0:26:38.82,A clever bird will choose its perch.,#A9A0FF
0:26:39.40,0:26:41.67,Even if I can’t fix the world immediately,,#A9A0FF
0:26:42.00,0:26:44.65,I must still bring peace to the world with my brush.,#A9A0FF
0:26:45.17,0:26:48.32,Nangong Wang: Pretty words, but pretty words alone won’t move me.,
0:26:49.85,0:26:51.80,Qi Yan: The Zhenzhen Highness is undoubtedly noble,,#A9A0FF
0:26:52.40,0:26:54.92,but everything she has now comes from His Majesty.,#A9A0FF
0:26:55.52,0:26:58.10,His Majesty is now fifty-one,,#A9A0FF
0:26:58.37,0:27:01.57,he will not be able to ensure that Her Highness has a lifetime of well-being.,#A9A0FF
0:27:02.25,0:27:06.17,As they say, a change of sovereign brings a change of ministers.,#A9A0FF
0:27:06.82,0:27:10.87,Before a new monarch succeeds the position, nothing is set in stone.,#A9A0FF
0:27:11.90,0:27:17.52,On this, the Third Highness and I share the same predicament.,#A9A0FF
0:27:19.70,0:27:20.62,Nangong Wang: Go on.,
0:27:22.00,0:27:25.25,Qi Yan: The reasoning behind choosing Your Highness, is not a blind leap of faith,,#A9A0FF
0:27:25.75,0:27:28.67,but a thought-out decision made after careful observation.,#A9A0FF
0:27:30.12,0:27:32.67,When observing His Majesty’s many Princes,,#A9A0FF
0:27:33.12,0:27:35.15,only the Third Highness is the most outstanding.,#A9A0FF
0:27:36.00,0:27:38.82,Yet, Your Highness is neither legitimate nor the eldest.,#A9A0FF
0:27:39.17,0:27:41.20,Without a justifiable reason, the path to success is impeded.,#A9A0FF
0:27:43.20,0:27:46.65,This subject is willing to exert all possible effort for Your Highness.,#A9A0FF
0:27:47.17,0:27:51.05,This subject only requests that it is not forgotten in the future.,#A9A0FF
0:27:54.55,0:27:57.17,Nangong Wang: You’re just so sure that I will make use of you?,
0:27:57.80,0:28:01.80,That I won’t have you tied up and handed to Emperor Father?,
0:28:03.10,0:28:07.62,Qi Yan: A monstrous schemer can only truly shine with a king of great talent and bold vision.,#A9A0FF
0:28:08.35,0:28:10.65,If the Third Highness has no such intent,,#A9A0FF
0:28:11.42,0:28:16.32,why did you acquaint yourself with me when I was just a scholar of modest background at the city’s outskirts?,#A9A0FF
0:28:17.20,0:28:18.17,Nangong Wang: Well said!,
0:28:19.32,0:28:23.90,Right now, I do have a troubling matter that I hope you can advise on, brother-in-law.,
0:28:24.55,0:28:25.92,Qi Yan: Please go ahead, Your Highness.,#A9A0FF
0:28:28.62,0:28:32.42,Nangong Wang: Although Emperor Father is in his prime, he is now fifty-one.,
0:28:32.95,0:28:34.72,Yet no Prince has been crowned.,
0:28:35.20,0:28:40.12,Those old officials have been pressing Emperor Father to crown a Prince for ‘the sake of the kingdom’ …,
0:28:40.77,0:28:42.25,You probably don’t know this yet,,
0:28:42.70,0:28:45.62,but Emperor Father has already decreed for old two to govern the kingdom during Qingming.,
0:28:46.82,0:28:49.57,Throughout history, only Crown Princes were given the authority to govern the kingdom.,
0:28:50.30,0:28:51.60,If this is carried out successfully,,
0:28:52.15,0:28:54.45,even if Emperor Father doesn’t crown a Prince for now,,
0:28:54.82,0:28:59.30,it will still give the court officials and common folks the idea that it’s a trial run.,
0:29:00.95,0:29:04.62,Tell me, what should I do?,
0:29:05.52,0:29:08.42,Qi Yan: The imperial decree has been given, it cannot be undone.,#A9A0FF
0:29:09.02,0:29:14.45,The only plan for now is to let the Second Prince make careless mistakes while governing the kingdom,,#A9A0FF
0:29:14.77,0:29:18.50,or simply to create some artificial problems.,#A9A0FF
0:29:19.07,0:29:23.72,Let His Majesty see that the Second Prince is not capable enough to shoulder great responsibility,,#A9A0FF
0:29:24.27,0:29:25.47,that is the best plan.,#A9A0FF
0:29:27.82,0:29:29.22,Nangong Wang: Hah, wouldn’t I know that?,
0:29:30.30,0:29:32.57,But old two has always been cautious and meticulous.,
0:29:32.87,0:29:35.95,Now that he finally has this chance, he will only be more careful.,
0:29:36.45,0:29:41.25,I am third in line while Nangong Ping’s birth is too low to inherit the throne.,
0:29:41.72,0:29:43.90,Old two and old four are brothers of the same parents.,
0:29:43.90,0:29:48.45,If anything happens to old two, Emperor Father will definitely suspect me.,
0:29:49.75,0:29:51.70,Doesn’t this make it pointless to depose old two?,
0:29:52.75,0:29:54.77,Wouldn’t it just make things easier for others?,
0:29:56.45,0:29:58.30,Qi Yan: What if it was a natural disaster?,#A9A0FF
0:29:59.15,0:30:01.75,Nangong Wang: I don’t have the ability to command nature.,
0:30:02.37,0:30:04.05,Qi Yan: Not exactly, Your Highness.,#A9A0FF
0:30:04.67,0:30:09.42,Based on what the Zhenzhen Highness describes, His Majesty is deeply superstitious.,#A9A0FF
0:30:10.27,0:30:12.80,We simply need to create some ominous signs,,#A9A0FF
0:30:13.17,0:30:17.05,and His Majesty will naturally connect it to the Second Prince.,#A9A0FF
0:30:19.32,0:30:20.52,Nangong Wang: Continue.,
0:30:21.62,0:30:24.85,Qi Yan: Your Highness, you only need to find some loyal subordinates who are willing to die for the cause,,#A9A0FF
0:30:24.85,0:30:26.47,and who have family of their own.,#A9A0FF
0:30:26.47,0:30:29.72,Grant them great rewards and have their family members ‘protected’.,#A9A0FF
0:30:30.62,0:30:34.38,Before the mission, feed them slow-acting poison,#A9A0FF
0:30:34.96,0:30:37.35,and have them hide separately in the inner courtyard of the imperial palace,#A9A0FF
0:30:37.35,0:30:38.77,and the ancestral tomb at the Yong province.,#A9A0FF
0:30:39.35,0:30:42.55,Arrange a specific hour to start fires at the same time…,#A9A0FF
0:30:43.95,0:30:49.07,By then, when fires break out simultaneously in the inner courtyard of the imperial palace and the ancestral tomb,,#A9A0FF
0:30:49.82,0:30:51.55,what will His Majesty think?,#A9A0FF
0:30:53.25,0:30:56.12,Nangong Wang: Emperor Father will surely think that it is an omen from the heavens,,
0:30:56.12,0:30:59.00,that the ancestors are saying old two is not a good choice for the Crown Prince!,
0:31:00.32,0:31:01.35,Qi Yan: That’s right.,#A9A0FF
0:31:01.95,0:31:06.35,His Majesty will surely choose to keep such a sinister matter from public knowledge,,#A9A0FF
0:31:06.35,0:31:08.00,even to the point of covering it up entirely.,#A9A0FF
0:31:08.30,0:31:10.90,Hence there will definitely not be a large-scale investigation,,#A9A0FF
0:31:11.72,0:31:16.05,but we will have successfully stripped the Second Prince’s right to inherit entirely.,#A9A0FF
0:31:16.42,0:31:17.35,Nangong Wang: Excellent!,
0:31:17.77,0:31:19.95,Brother-in-law is a genius indeed.,
0:31:19.95,0:31:21.32,I will return to my estate to arrange this right away.,
0:31:21.32,0:31:23.42,Qi Yan: Just a moment, Your Highness.,#A9A0FF
0:31:24.37,0:31:27.92,This subject has a few more suggestions regarding this matter.,#A9A0FF
0:31:28.67,0:31:29.65,Nangong Wang: Please go ahead, brother-in-law.,
0:31:30.37,0:31:34.97,Qi Yan: This subject suggests burning the Weiming palace.,#A9A0FF
0:32:02.45,0:32:08.52,[Princess estate, Qi Yan’s bedroom],
0:32:09.52,0:32:10.55,Nangong Jingnu: Qi Yan,,#FF7D40
0:32:13.27,0:32:14.97,Qi Yan, I’m back!,#FF7D40
0:32:15.82,0:32:16.92,Qi Yan: Your Highness.,#A9A0FF
0:32:16.92,0:32:18.17,Nangong Jingnu: Are you reading?,#FF7D40
0:32:19.30,0:32:21.95,I heard from Qiuju that you didn’t even have dinner.,#FF7D40
0:32:22.45,0:32:24.30,Guess what I brought for you?,#FF7D40
0:32:25.82,0:32:26.75,Qi Yan: This subject…,#A9A0FF
0:32:27.02,0:32:28.15,has no idea.,#A9A0FF
0:32:28.15,0:32:29.47,[Nangong Jingnu brings out a food box she hid behind her back],
0:32:29.47,0:32:30.45,Nangong Jingnu: Here!,#FF7D40
0:32:30.45,0:32:34.40,Roasted lamb from the palace, I can see you liked it a lot during the last palace banquet…,#FF7D40
0:32:35.67,0:32:36.55,Qi Yan: Oh…,#A9A0FF
0:32:37.80,0:32:40.60,Nangong Jingnu: This dish was served during the meal just now,,#FF7D40
0:32:40.60,0:32:43.60,so I told the cook to set aside a plate of the tenderest slices and brought it back for you.,#FF7D40
0:32:43.60,0:32:45.15,[Memory],
0:32:45.15,0:32:48.75,Qi Yan: This subject suggests burning the Weiming palace!,#A9A0FF
0:32:49.37,0:32:50.60,Nangong Wang: For what reason?,
0:32:52.55,0:32:58.65,Qi Yan: Of course, burning His Majesty’s Ganquan palace will have far greater impact than the Weiyang Palace.,#A9A0FF
0:32:59.60,0:33:01.40,But do not forget, Your Highness.,#A9A0FF
0:33:01.87,0:33:06.30,Even if His Majesty is not in the palace, the Ganquan palace still houses the Emperor’s jade seal.,#A9A0FF
0:33:06.67,0:33:10.02,It will definitely be highly guarded and difficult to infiltrate.,#A9A0FF
0:33:11.35,0:33:13.57,But things are different for the Weiming palace.,#A9A0FF
0:33:14.02,0:33:16.32,When the Zhenzhen Highness moved from palace to estate,,#A9A0FF
0:33:16.32,0:33:17.92,she had two thousand estate soldiers,,#A9A0FF
0:33:18.75,0:33:22.65,and part of them are guards transferred from the Weiming palace.,#A9A0FF
0:33:24.02,0:33:30.32,Eighty-percent of the guards presently remaining at the Weiming palace were transferred over after that.,#A9A0FF
0:33:30.92,0:33:35.35,They are not very familiar with the location, so it will be easier to sneak past them,,#A9A0FF
0:33:35.87,0:33:38.35,and more convenient for the infiltrators to escape as well…,#A9A0FF
0:33:39.95,0:33:46.07,Qi Yan: Most importantly, the Weiming palace was modified from the East palace of the Crown Prince of the previous reign.,#A9A0FF
0:33:46.07,0:33:48.57,Fire at the Ganquan palace might be a highly ominous sign,,#A9A0FF
0:33:48.57,0:33:50.45,but it does not point clearly at anyone.,#A9A0FF
0:33:51.60,0:33:55.67,Additionally, considering how much His Majesty cares for the Zhenzhen Highness,,#A9A0FF
0:33:56.15,0:33:59.10,he will not let this matter go easily.,#A9A0FF
0:34:01.55,0:34:03.36,Nangong Wang: With the assistance of brother-in-law,,
0:34:03.36,0:34:05.12,what is there left for me to worry about?,
0:34:06.11,0:34:08.21,Since brother-in-law could take this loss of property for my sake,,
0:34:08.51,0:34:11.35,I will compensate you well.,
0:34:12.74,0:34:16.05,[Qi Yan opens a wooden box and brings out a painting],
0:34:17.69,0:34:18.96,Qi Yan: This is…,#A9A0FF
0:34:18.96,0:34:21.16,a map of the Weiming palace,,#A9A0FF
0:34:21.16,0:34:23.40,the changing shifts for the guards and servant girls,,#A9A0FF
0:34:23.40,0:34:24.81,and the path of patrol…,#A9A0FF
0:34:26.11,0:34:28.48,all illustrated by the hand of this subject.,#A9A0FF
0:34:29.16,0:34:31.73,[Memory ends],
0:34:34.24,0:34:37.73,Nangong Jingnu: Qi Yan, Qi Yan?,#FF7D40
0:34:37.73,0:34:40.20,What’s wrong, don’t scare me like this!,#FF7D40
0:34:42.17,0:34:43.24,Qi Yan: Oh, it’s nothing…,#A9A0FF
0:34:44.07,0:34:46.20,Your Highness, there’s nothing wrong with this subject.,#A9A0FF
0:34:47.92,0:34:50.34,Nangong Jingnu: Your complexion worsened a lot all of a sudden,,#FF7D40
0:34:50.34,0:34:51.62,what happened to you?,#FF7D40
0:34:53.28,0:34:54.31,Qi Yan: This subject…,#A9A0FF
0:34:55.63,0:34:57.62,this subject is just a little out of sorts.,#A9A0FF
0:34:58.25,0:35:00.89,After running around all morning, this subject is somewhat tired…,#A9A0FF
0:35:01.65,0:35:04.25,This subject truly has no appetite.,#A9A0FF
0:35:05.59,0:35:07.68,Nangong Jingnu: Don’t eat it if you have no appetite.,#FF7D40
0:35:07.72,0:35:10.86,It’s just a plate of mutton, is it worth getting you like this?,#FF7D40
0:35:12.45,0:35:13.84,Qi Yan: This subject…,#A9A0FF
0:35:14.55,0:35:15.90,Nangong Jingnu: Emperor Father said that,,#FF7D40
0:35:15.90,0:35:18.38,three days later, we’ll leave for the Yong province to worship our ancestors,,#FF7D40
0:35:18.38,0:35:20.80,and then head to the Ding province for the spring hunt.,#FF7D40
0:35:20.80,0:35:23.08,There will have to be a long trek,,#FF7D40
0:35:23.73,0:35:25.15,your body…,#FF7D40
0:35:26.02,0:35:27.16,Qi Yan: It’s fine.,#A9A0FF
0:35:27.88,0:35:29.16,This subject is just…,#A9A0FF
0:35:29.33,0:35:31.15,a little tired today.,#A9A0FF
0:35:31.73,0:35:35.27,Nangong Jingnu: Oh, then have a good rest, I’ll go back now.,#FF7D40
0:35:35.27,0:35:36.50,[Qi Yan holds onto Nangong Jingnu’s sleeve],
0:35:36.50,0:35:37.31,Qi Yan: Your Highness.,#A9A0FF
0:35:38.56,0:35:39.46,Nangong Jingnu: Yes?,#FF7D40
0:35:41.54,0:35:42.57,Qi Yan: Your Highness…,#A9A0FF
0:35:43.65,0:35:45.15,Can you stay, please?,#A9A0FF
0:35:46.06,0:35:46.83,Nangong Jingnu: Huh?,#FF7D40
0:35:47.50,0:35:50.77,Qi Yan: Your Highness, please stay.,#A9A0FF
0:35:51.51,0:35:53.59,This subject just wishes to talk with Your Highness.,#A9A0FF
0:35:54.04,0:35:57.40,Like the day of the wedding, this subject will still sleep on the couch.,#A9A0FF
0:35:58.45,0:35:59.39,Nangong Jingnu: Mmh…,#FF7D40
0:36:00.02,0:36:02.23,Do you even have a couch in your room?,#FF7D40
0:36:02.66,0:36:05.82,And besides, you’re not looking so good, you should sleep on the bed.,#FF7D40
0:36:08.57,0:36:09.65,Qi Yan: Your Highness?,#A9A0FF
0:36:13.16,0:36:16.52,Nangong Jingnu: I believe in your character, I’ll just sleep on the inner side.,#FF7D40
0:36:17.93,0:36:19.37,Qi Yan: Thank you very much, Your Highness.,#A9A0FF
0:36:20.13,0:36:21.76,Nangong Jingnu: I’ll go and let Qiuju know,,#FF7D40
0:36:21.76,0:36:23.60,or she’ll end up looking around for me in the middle of the night.,#FF7D40
0:36:23.60,0:36:25.26,Qi Yan: Mn, alright.,#A9A0FF
0:36:29.67,0:36:32.54,Nangong Jingnu: Qiuju, I’m going to sleep here today.,#FF7D40
0:36:32.54,0:36:35.16,You should rest early as well, there’s no need to keep attending.,#FF7D40
0:36:35.34,0:36:36.41,Qiuju: Understood.,
0:36:41.92,0:36:43.89,[Qiuju walks to the door],
0:36:44.18,0:36:45.97,Qiuju: Her Highness is going to stay here for the night.,
0:36:45.97,0:36:46.92,Light the lantern,,
0:36:47.38,0:36:49.67,and then go to report to the recording auntie.,
0:36:50.36,0:36:51.28,Servant girl: Understood.,
0:36:53.84,0:36:57.60,[Servant girl walks quickly to the recording auntie’s place],
0:37:05.17,0:37:08.17,Servant girl: Reporting to auntie, Her Highness is staying the night in Lord Fuma’s room,,
0:37:08.17,0:37:10.52,Qiuju jiejie ordered this maid to report to you.,
0:37:10.84,0:37:12.72,Recording auntie: Got it, I will write it down now.,
0:37:24.23,0:37:27.48,Recording auntie: Jingjia Ninth Year, Sixteenth day of the First Month,,
0:37:27.81,0:37:34.15,the Zhenzhen Princess stayed the night at Fuma’s place, visiting on her own accord…,
0:37:55.94,0:37:59.35,[Princess estate, Qi Yan’s bedroom],
0:38:08.55,0:38:11.01,Qi Yan: Your Highness, are you finding it difficult to sleep in a different bed?,#A9A0FF
0:38:14.55,0:38:18.67,Nangong Jingnu: It’s not that, I… I…,#FF7D40
0:38:20.49,0:38:23.24,Qi Yan: Is Your Highness, afraid of the dark?,#A9A0FF
0:38:25.93,0:38:26.71,Nangong Jingnu: Mn.,#FF7D40
0:38:28.55,0:38:31.26,Qi Yan: Then this subject will scoot in closer, is that alright?,#A9A0FF
0:38:33.52,0:38:35.25,Nangong Jingnu: Mn, alright.,#FF7D40
0:38:41.36,0:38:42.84,Qi Yan: Is that better, Your Highness?,#A9A0FF
0:38:45.86,0:38:46.83,Nangong Jingnu: Thank you.,#FF7D40
0:38:53.50,0:38:54.93,Qi Yan: **Must you thank me?**,#A9A0FF
0:38:56.12,0:39:00.40,**I’m just a malevolent spirit who is working whole mindedly to take the life of your entire clan.**,#A9A0FF
0:39:01.54,0:39:03.94,**I have just offered a plan to burn your palace,**,#A9A0FF
0:39:04.88,0:39:06.74,**yet you foolishly brought me something to eat…**,#A9A0FF
0:39:19.28,0:39:20.02,Nangong Jingnu: …Qi Yan?,#FF7D40
0:39:21.97,0:39:23.76,Qi Yan: …Yes, Your Highness.,#A9A0FF
0:39:26.02,0:39:29.96,Nangong Jingnu: There’s something, I, I want to ask you.,#FF7D40
0:39:30.70,0:39:31.91,Qi Yan: Please go ahead, Your Highness.,#A9A0FF
0:39:34.53,0:39:38.84,Nangong Jingnu: Although that brute, Lu Zhongxing, isn’t getting along well with er-jie,,#FF7D40
0:39:39.46,0:39:41.18,judging from what da-jie said today,,#FF7D40
0:39:41.83,0:39:43.04,for the two of them…,#FF7D40
0:39:43.04,0:39:46.65,the worst end scenario is just to live their separate lives.,#FF7D40
0:39:47.01,0:39:50.12,A divorce will be very difficult to achieve.,#FF7D40
0:39:51.31,0:39:51.91,Qi Yan: Mn.,#A9A0FF
0:39:54.35,0:39:55.14,Nangong Jingnu: So…,#FF7D40
0:39:55.81,0:39:58.70,What about, you and er-jie?,#FF7D40
0:39:59.39,0:40:00.02,Qi Yan: Hmm?,#A9A0FF
0:40:01.09,0:40:02.10,Us?,#A9A0FF
0:40:03.18,0:40:04.32,What about us?,#A9A0FF
0:40:06.18,0:40:10.12,Nangong Jingnu: Aren’t you two in love with each other?,#FF7D40
0:40:12.65,0:40:15.40,Qi Yan: Since when was the Second Highness and I in love with each other?!,#A9A0FF
0:40:16.99,0:40:19.23,Nangong Jingnu: Aren't you the Hermit Shepherd?,#FF7D40
0:40:19.66,0:40:21.72,Qi Yan: Oh, I am.,#A9A0FF
0:40:22.82,0:40:24.36,Nangong Jingnu: And you’re still denying it?,#FF7D40
0:40:24.94,0:40:27.18,Er-jie has a folding fan that she holds dear to her heart,,#FF7D40
0:40:27.52,0:40:30.34,and the writing on it is signed by the Hermit Shepherd!,#FF7D40
0:40:33.32,0:40:34.55,Qi Yan: That’s…,#A9A0FF
0:40:37.35,0:40:38.29,Nangong Jingnu: Are you admitting it now?,#FF7D40
0:40:38.83,0:40:40.02,Qi Yan: No.,#A9A0FF
0:40:40.53,0:40:42.48,Your Highness, let me explain.,#A9A0FF
0:40:43.02,0:40:45.46,That writing on the fan is indeed the work of this subject,,#A9A0FF
0:40:45.82,0:40:48.39,but the owner of that fan was someone else!,#A9A0FF
0:40:48.66,0:40:51.17,Nangong Jingnu: Oh, who was it?,#FF7D40
0:40:51.95,0:40:54.31,Qi Yan: An old friend this subject made during the pre-student exams,,#A9A0FF
0:40:54.31,0:40:58.14,surnamed Gongyang, named Huai, courtesy name Baishi.,#A9A0FF
0:40:58.52,0:40:59.30,Nangong Jingnu: Huh?,#FF7D40
0:41:00.71,0:41:02.57,Qi Yan: Is… there a problem?,#A9A0FF
0:41:03.67,0:41:06.49,Nangong Jingnu: Hold on, let me sort it out…,#FF7D40
0:41:07.27,0:41:10.95,So, although the writing on the fan is yours,,#FF7D40
0:41:11.37,0:41:14.46,the fan itself actually belongs to Gongyang Huai.,#FF7D40
0:41:14.91,0:41:19.26,When Er-jie picked up Gongyang Huai’s fan and saw the writing on it,,#FF7D40
0:41:19.26,0:41:22.37,she assumed that Gongyang Huai is the Hermit Shepherd, so…,#FF7D40
0:41:23.11,0:41:27.77,So, you and er-jie didn’t know each other at all?,#FF7D40
0:41:29.09,0:41:29.85,Qi Yan: That’s right.,#A9A0FF
0:41:34.10,0:41:34.82,Nangong Jingnu: So…,#FF7D40
0:41:35.69,0:41:37.40,So that’s how it is?,#FF7D40
0:41:39.01,0:41:40.44,Qi Yan: What does Your Highness mean by this?,#A9A0FF
0:41:40.89,0:41:43.02,When has this subject and the Second Highness ever been in love with each other?,#A9A0FF
0:41:43.69,0:41:45.17,This is not something to be said carelessly.,#A9A0FF
0:41:47.63,0:41:49.92,Nangong Jingnu: Um, I’m tired,,#FF7D40
0:41:50.57,0:41:52.83,not just tired, I’m sleepy…,#FF7D40
0:41:53.23,0:41:54.44,I’m going to sleep,,#FF7D40
0:41:56.50,0:41:57.91,you can’t talk anymore!,#FF7D40
0:42:01.56,0:42:05.21,[Nangong Jingnu turns around and goes to sleep],
0:42:05.68,0:42:06.56,Qi Yan: Your Highness?,#A9A0FF
0:42:19.35,0:42:23.62,Qi Yan: **Your Highness, before I kill you with my own hands,**,#A9A0FF
0:42:24.74,0:42:26.53,**I will treat you with sincerity too.**,#A9A0FF
0:43:04.12,0:43:09.47,Jingnu: You, my first love, my forever,#FF7D40
0:43:09.47,0:43:12.64,the ocean depths, the searing flame,#FF7D40
0:43:12.64,0:43:17.06,sincerity, and illusion,#FF7D40
0:43:17.06,0:43:22.32,I, fell for you, made mistakes,#FF7D40
0:43:22.32,0:43:25.42,sated my thirst, lost my mind,#FF7D40
0:43:25.42,0:43:30.04,what I sowed, I reaped,#FF7D40
0:43:33.04,0:43:38.14,Qi Yan: You, in the court, by my pillow,#A9A0FF
0:43:38.14,0:43:41.54,the diverging path, in my heart,#A9A0FF
0:43:41.54,0:43:45.72,before my eyes, in the horizon,#A9A0FF
0:43:45.72,0:43:50.77,I, can't break free, can't linger,#A9A0FF
0:43:50.77,0:43:54.25,can't hate, can't understand,#A9A0FF
0:43:54.25,0:43:59.18,can't decide, can't take a side,#A9A0FF
0:44:00.23,0:44:04.75,My heart, is already wrung apart,#A9A0FF
0:44:04.75,0:44:06.61,ground to dust,#A9A0FF
0:44:06.61,0:44:13.00,There is no room for regret in a path towards a dead end,#A9A0FF
0:44:13.00,0:44:17.50,Jingnu: My love, fallen with my tear,#FF7D40
0:44:17.50,0:44:19.35,No one to blame,#FF7D40
0:44:19.35,0:44:25.78,Except me for a true love wrongly given,#FF7D40
0:44:38.33,0:44:43.84,Qi Yan: The path, no looking ahead, no looking back,#A9A0FF
0:44:43.84,0:44:47.14,no hesitation, no way back,#A9A0FF
0:44:47.14,0:44:51.39,no calculation, no letting go,#A9A0FF
0:44:51.39,0:45:05.79,Jingnu: Sigh, at the battle, the pain, the love, the dream, the show, all for naught,#FF7D40
0:45:05.79,0:45:10.43,Together: My heart, is already wrung apart,
0:45:10.43,0:45:12.29,ground to dust,
0:45:12.29,0:45:18.63,There is no room for regret in a path towards a dead end,
0:45:18.63,0:45:23.18,My love, fallen with my tear,
0:45:23.18,0:45:25.13,No one to blame,
0:45:25.13,0:45:31.12,Except me for a true love wrongly given,
0:45:31.12,0:45:36.16,Qi Yan: My heart, is already wrung apart,#A9A0FF
0:45:36.16,0:45:37.75,ground to dust,#A9A0FF
0:45:37.75,0:45:44.23,There is no room for regret in a path towards a dead end,#A9A0FF
0:45:44.23,0:45:48.66,Jingnu: My love, fallen with my tear,#FF7D40
0:45:48.66,0:45:50.62,No one to blame,#FF7D40
0:45:50.62,0:45:56.94,Except me for a true love wrongly given,#FF7D40
0:45:56.94,0:46:01.85,Together: My heart(heart), is already wrung apart,
0:46:01.85,0:46:03.54,ground to dust,
0:46:03.54,0:46:09.75,There is no room for regret in a path towards a dead end,
0:46:09.75,0:46:14.48,My love(love), fallen with my tear,
0:46:14.48,0:46:16.09,No one to blame,
0:46:16.09,0:46:22.73,Except me for a true love wrongly given,
0:46:22.73,0:46:32.95,I'll return to you in another life, and try again,